{"delegation":{"profile_id":"potbot-identity-v1","public_key":"TooHDL9YK5RaKlAf2N+uz0OKYdc3PVBEyr9TGiLoxTo=","public_key_algorithm":"Ed25519","public_key_encoding":"base64","schema_version":1,"signature":"IsLnxWhAw+UWYmidjZU0z2glvsXj2sKiYg1zd/pJ85yzduTvuDdB22xBGQIrVd4r7ErI0W0tX742qessV50wAw==","signature_algorithm":"Ed25519","signature_encoding":"base64","signer_hash":"28996c77aba50985b85b6c81f0e60d5b405b81a45efdafb3fda5d9f8581720e8","signing_epoch":497940,"signing_profile_id":"potbot-hourly-signing-v1","type_ref":"synny://type/hourly-key-delegation","valid_from":1792584000,"valid_until":1792587600},"envelope":{"audience":"test","domain":"potbot.event.v2","expires_at":"2026-10-21T12:05:00Z","issued_at":"2026-10-21T12:00:00Z","payload_sha256":"f16d05ec6b29248d2c61adb1e9263f78e4f7bace1b955014a2d17872cfe4064d","payload_type_ref":"synny://type/ember","profile_id":"potbot-identity-v1","request_id":"00000000-0000-4000-8000-000000000002","schema_version":2,"signature":"jRie+JZKWId7OILrlFR8v+NWa6tNtP8wADEXGi404fpzrntgOEh09uPyl6Z3dT9ViEHKPO7WzBduS5e4rOvyBA==","signature_algorithm":"Ed25519","signature_encoding":"base64","signer_hash":"28996c77aba50985b85b6c81f0e60d5b405b81a45efdafb3fda5d9f8581720e8","signing_epoch":497940,"signing_profile_id":"potbot-hourly-signing-v1","type_ref":"synny://type/signature-envelope","workspace_id":"00000000-0000-4000-8000-000000000001"},"identity":{"hash_algorithm":"SHA-256","profile_id":"potbot-identity-v1","public_key":"xRBxKJeyvMrgdgnYwI7IdK17a7GrTm/KOYiV9I9obtI=","public_key_algorithm":"Ed25519","public_key_encoding":"base64","schema_version":2,"signer_hash":"28996c77aba50985b85b6c81f0e60d5b405b81a45efdafb3fda5d9f8581720e8","type_ref":"synny://type/public-identity-descriptor"},"schema_version":1,"type_ref":"synny://type/public-signature-bundle"}